{
  "$schema": "http://json-schema.org/draft-04/schema#",
  "description": "",
  "type": "object",
  "properties": {
    "service_instance_uuid": {
      "type": "string",
      "minLength": 1
    },
    "data": {
      "type": "object",
      "properties": {
        "type": {
          "type": "string",
          "minLength": 1
        },
        "connections": {
          "type": "array",
          "uniqueItems": true,
          "minItems": 1,
          "items": {
            "required": [
              "name"
            ],
            "properties": {
              "bandwidth": {
                "type": "object",
                "properties": {
                  "qos_class": {
                    "type": "string",
                    "minLength": 1
                  },
                  "capacity": {
                    "type": "string",
                    "minLength": 1
                  }
                },
                "required": [
                  "qos_class",
                  "capacity"
                ]
              },
              "name": {
                "type": "string",
                "minLength": 1
              },
              "terminals": {
                "type": "array",
                "uniqueItems": true,
                "minItems": 1,
                "items": {
                  "required": [
                    "vlan_tag",
                    "uri"
                  ],
                  "properties": {
                    "vlan_tag": {
                      "type": "string",
                      "minLength": 1
                    },
                    "uri": {
                      "type": "string",
                      "minLength": 1
                    }
                  }
                }
              }
            }
          }
        }
      },
      "required": [
        "type",
        "connections"
      ]
    },
    "service": {
      "type": "string",
      "minLength": 1
    },
    "options": {
      "type": "array",
      "items": {
        "required": [],
        "properties": {}
      }
    },
    "service_profile_uuid": {
      "type": "string",
      "minLength": 1
    },
    "queries": {
      "type": "array",
      "items": {
        "required": [],
        "properties": {}
      }
    }
  },
  "required": [
    "service_instance_uuid",
    "data",
    "service",
    "options",
    "service_profile_uuid",
    "queries"
  ]
}